{
  "$schema": "http://json-schema.org/draft-07/schema#",
  "title": "Beariscope Data Schema",
  "type": "object",
  "properties": {
    "metadata": {
      "type": "array",
      "items": {
        "$ref": "#/$defs/dataField"
      }
    },
    "auto": {
      "type": "array",
      "items": {
        "$ref": "#/$defs/dataField"
      }
    },
    "tele": {
      "type": "array",
      "items": {
        "$ref": "#/$defs/dataField"
      }
    },
    "endgame": {
      "type": "array",
      "items": {
        "$ref": "#/$defs/dataField"
      }
    }
  },
  "required": [
    "metadata",
    "auto",
    "tele",
    "endgame"
  ],
  "$defs": {
    "dataField": {
      "type": "object",
      "properties": {
        "id": {
          "type": "string"
        },
        "display_name": {
          "type": "string"
        },
        "type": {
          "type": "string",
          "enum": [
            "integer",
            "string",
            "boolean"
          ]
        },
        "enum": {
          "type": "array",
          "items": {}
        }
      },
      "required": [
        "id",
        "display_name",
        "type"
      ]
    }
  }
}
